{"case_id":"SHC014","decision":"candidate","candidate_ranking":["C08","C04","C14"],"selected_candidate_label":"C08","confidence":0.99,"relationship_type":"both","rationale":"C08 is the immediately preceding report in the same Iran-emergency reporting series and supplies both the later letter’s highly specific language and its substantive organization. The child updates the same five-part framework: regulatory amendments; Tribunal awards and Security Account replenishment; government-to-government claims; private U.S.-national claims; and a nearly verbatim concluding assessment and commitment. C04 and C14 are also strong antecedents in the same drafting lineage, but C08 is the most direct template because the child expressly identifies the May 1997 report as intervening while carrying forward matters and formulations already present in C08.","shared_material":[{"child_excerpt":"I hereby report to the Congress on developments since the last Presidential report of May 13, 1997, concerning the national emergency with respect to Iran that was declared in [DIRECTIVE_REFERENCE] of November 14, 1979. This report is submitted pursuant to section 204(c) of the International Emergency Economic Powers Act, 50 U.S.C. 1703(c) (IEEPA).","parent_excerpt":"I hereby report to the Congress on developments since the last Presidential report of May 16, 1996, concerning the national emergency with respect to Iran that was declared in [DIRECTIVE_REFERENCE] of November 14, 1979. This report is submitted pursuant to section 204(c) of the International Emergency Economic Powers Act, 50 U.S.C. 1703(c).","explanation":"The openings share distinctive, nearly verbatim report-series language, with only report dates and minor formatting changed."},{"child_excerpt":"The Iran-United States Claims Tribunal (the \"Tribunal\"), established at The Hague pursuant to the Algiers Accords, continues to make progress in arbitrating the claims before it.... The United States continues to pursue Case A/28... The United States also continues to pursue Case A/29...","parent_excerpt":"The Iran-United States Claims Tribunal (the \"Tribunal\"), established at The Hague pursuant to the Algiers Accords, continues to make progress in arbitrating the claims before it.... Therefore, the United States continues to pursue Case A/28... The United States also continues to pursue Case A/29...","explanation":"The child retains the same specialized Tribunal and Security Account section, including the same two cases, while updating awards, balances, and procedural posture."},{"child_excerpt":"The Department of State continues to respond to claims brought against the United States by Iran, in coordination with concerned government agencies.... On August 8, 1997, the United States filed its Statement of Defense in Case A/30...","parent_excerpt":"The Department of State continues to present other United States Government claims against Iran and to respond to claims brought against the United States by Iran, in coordination with concerned government agencies.... In August 1996, Iran filed a Statement of Claim in a new case, number A/30... The United States is currently preparing its Statement of Defense...","explanation":"The child directly updates the parent’s government-claims section and the procedural history of the same Case A/30."},{"child_excerpt":"The situation reviewed above continues to implicate important diplomatic, financial, and legal interests of the United States and its nationals and presents an unusual challenge to the national security and foreign policy of the United States.... I shall continue to exercise the powers at my disposal to deal with these problems and will continue to report periodically to the Congress on significant developments.","parent_excerpt":"The situation reviewed above continues to implicate important diplomatic, financial, and legal interests of the United States and its nationals and presents an unusual challenge to the national security and foreign policy of the United States.... I shall continue to exercise the powers at my disposal to deal with these problems and will continue to report periodically to the Congress on significant developments.","explanation":"The concluding assessment and commitment are reproduced essentially verbatim, providing strong evidence of literal template reuse."}]}