{"case_id":"SHC056","decision":"candidate","candidate_ranking":["C04","C18","C03"],"selected_candidate_label":"C04","confidence":0.99,"relationship_type":"both","rationale":"C04 plausibly supplied a concrete drafting template. Issued less than two months earlier, it shares the child's national-emergency formulation, the same sanctions chapeau, an essentially verbatim anti-evasion prohibition, closely matching definitions, and the same sequence of Treasury implementation, redelegation, agency direction, rights disclaimer, effective-time provision, and congressional transmission/publication. This combined literal and structural correspondence materially exceeds routine similarity among sanctions orders.","shared_material":[{"child_excerpt":"find that the actions and policies of the Government of Iran constitute an unusual and extraordinary threat to the national security, foreign policy, and economy of the United States, and hereby declare a national emergency to deal with that threat.","parent_excerpt":"find that grave acts of violence committed by foreign terrorists that disrupt the Middle East peace process constitute an unusual and extraordinary threat to the national security, foreign policy, and economy of the United States, and hereby declare a national emergency to deal with that threat.","explanation":"The child retains the parent's complete emergency-finding sentence frame while substituting the threat predicate."},{"child_excerpt":"The following are prohibited, except to the extent provided in regulations, orders, directives, or licenses that may be issued pursuant to this order, and notwithstanding any contract entered into or any license or permit granted prior to the effective date of this order","parent_excerpt":"Except to the extent provided in ... regulations, orders, directives, or licenses that may be issued pursuant to this order, and notwithstanding any contract entered into or any license or permit granted prior to the effective date","explanation":"The operative sanctions begin with nearly identical exception and prior-contract language."},{"child_excerpt":"any transaction by any United States person or within the United States that evades or avoids, or has the purpose of evading or avoiding, or attempts to violate, any of the prohibitions set forth in this order","parent_excerpt":"any transaction by any United States person or within the United States that evades or avoids, or has the purpose of evading or avoiding, or attempts to violate, any of the prohibitions set forth in this order","explanation":"The anti-evasion provision is effectively verbatim."},{"child_excerpt":"The term \"person\" means an individual or entity; ... The term \"entity\" means a partnership, association, trust, joint venture, corporation, or other organization; ... The term \"United States person\" means any United States citizen, permanent resident alien, entity organized under the laws of the United States (including foreign branches), or any person in the United States","parent_excerpt":"the term \"person\" means an individual or entity; ... the term \"entity\" means a partnership, association, corporation, or other organization, group, or subgroup; ... the term \"United States person\" means any United States citizen, permanent resident alien, entity organized under the laws of the United States (including foreign branches), or any person in the United States","explanation":"The child reuses the same three-definition sequence and nearly identical wording, expanding only the entity examples."},{"child_excerpt":"The Secretary of the Treasury, in consultation with the Secretary of State, is hereby authorized to take such actions, including the promulgation of rules and regulations, and to employ all powers granted to me by the International Emergency Economic Powers Act as may be necessary to carry out the purposes of this order. The Secretary of the Treasury may redelegate any of these functions ... All agencies ... are hereby directed to take all appropriate measures within their authority","parent_excerpt":"The Secretary of the Treasury, in consultation with the Secretary of State and, as appropriate, the Attorney General, is hereby authorized to take such actions, including the promulgation of rules and regulations, and to employ all powers granted to me by IEEPA as may be necessary to carry out the purposes of this order. The Secretary of the Treasury may redelegate any of these functions ... All agencies ... are hereby directed to take all appropriate measures within their authority","explanation":"The same implementation machinery and sentence sequence are carried over, with the Attorney General coordination removed."},{"child_excerpt":"Nothing contained in this order shall create any right or benefit, substantive or procedural, enforceable by any party against the United States ... This order is effective at 12:01 a.m., eastern standard time ... This order shall be transmitted to the Congress and published in the Federal Register.","parent_excerpt":"Nothing contained in this order shall create any right or benefit, substantive or procedural, enforceable by any party against the United States ... This order is effective at 12:01 a.m., eastern standard time ... This order shall be transmitted to the Congress and published in the Federal Register.","explanation":"The closing sections reproduce the parent's wording and order almost exactly."}]}