{"case_id":"SHC084","decision":"candidate","candidate_ranking":["C05","C15","C09"],"selected_candidate_label":"C05","confidence":0.99,"relationship_type":"both","rationale":"C05 is an exceptionally close, concrete drafting template. The child reproduces its three-part recital and operative structure, with Poland substituted for Hungary: a section 502 eligibility determination using the same language, a section 604 HTS authority recital, insertion of the country into the same HTS general note and list, an identical supersession clause, and the same dual effective-date formula. C15 and C09 contain related country-designation machinery, but each uses the older TSUS framework and includes additional subject matter.","shared_material":[{"child_excerpt":"Pursuant to section 502 of the Trade Act of 1974, as amended ... and having due regard for the eligibility criteria set forth therein, I have determined that it is appropriate to designate Poland as a beneficiary developing country for purposes of the Generalized System of Preferences (GSP).","parent_excerpt":"Pursuant to section 502(a), (b), and (c) of the Trade Act of 1974, as amended ... and having due regard for the eligibility criteria set forth therein, I have determined that it is appropriate to designate Hungary as a beneficiary developing country for purposes of the Generalized System of Preferences (GSP).","explanation":"Nearly verbatim eligibility determination with only statutory-detail and country substitutions."},{"child_excerpt":"General note 3(c)(ii)(A) to the HTS ... is modified by inserting in alphabetical order in the list of independent countries \"Poland\".","parent_excerpt":"General note 3(c)(ii)(A) to the HTS ... is modified by inserting in alphabetical order in the list of independent countries \"Hungary\".","explanation":"Identical operative tariff-schedule machinery applied to a new country."},{"child_excerpt":"Any provisions of previous proclamations and executive orders inconsistent with the provisions of this proclamation are hereby superseded to the extent of such inconsistency.","parent_excerpt":"Any provisions of previous proclamations and Executive orders inconsistent with the provisions of this Proclamation are hereby superseded to the extent of such inconsistency.","explanation":"Same supersession provision in the same position within the operative sequence."},{"child_excerpt":"The amendments made by this proclamation shall be effective with respect to articles both: (i) imported on or after January 1, 1976, and (ii) entered, or withdrawn from warehouse for consumption, on or after the date of publication of this proclamation in the Federal Register.","parent_excerpt":"The amendments made by this Proclamation shall be effective with respect to articles both: (i) imported on or after January 1, 1976, and (ii) entered, or withdrawn from warehouse for consumption, on or after the date of publication of this Proclamation in the Federal Register.","explanation":"Verbatim dual-condition effective-date provision, completing the same three-paragraph operative sequence."}]}