{"case_id":"SHC011","decision":"candidate","candidate_ranking":["C22","C01","C07"],"selected_candidate_label":"C22","confidence":0.98,"relationship_type":"both","rationale":"C22 plausibly supplied the principal reporting template: both are presidential letters reporting to Congress on developments since the previous report concerning a declared national emergency, organize the substantive report as numbered developments, and close by stating that the underlying foreign-policy problem persists, emergency powers will continue to be exercised, and periodic congressional reports will continue. C01 also materially supplied the Nicaragua-specific substance, including the four prohibitions and threat formulation, but it is the underlying sanctions order rather than the strongest template for the later report's form. C07 shares Nicaragua-related transmittal conventions and some policy language, but less of the distinctive emergency-report machinery.","shared_material":[{"child_excerpt":"I hereby report to the Congress on developments since my last report of May 23, 1986, concerning the national emergency with respect to Nicaragua","parent_excerpt":"I hereby report to the Congress with respect to developments since my last report of May 3, 1984, concerning the national emergency with respect to Iran","explanation":"Near-verbatim opening formula identifying a periodic update since the previous report concerning a country-specific national emergency."},{"child_excerpt":"I shall continue to exercise the powers at my disposal to apply economic sanctions against Nicaragua ... and will continue to report periodically to the Congress on expenses and significant developments","parent_excerpt":"I shall continue to exercise the powers at my disposal to deal with these problems and will continue to report periodically to the Congress on significant developments.","explanation":"Distinctive parallel closing that couples continued use of emergency powers with continued periodic reporting to Congress."},{"child_excerpt":"1. The declaration of emergency ... 2. The Office of Foreign Assets Control ... 3. Since my report ... 4. The trade sanctions ... 5. The expenses incurred ... 6. The policies and actions ...","parent_excerpt":"1. The Iran-United States Claims Tribunal ... 2. In the past six months ... 3. The Tribunal ... 4. The Department of State ... 5. In the last six months ... 10. Financial and diplomatic aspects ...","explanation":"Both use a numbered administrative-status report covering developments during the reporting period and concluding with the continuing emergency rationale."},{"child_excerpt":"the policies and actions of the Sandinista government continue to pose an unusual and extraordinary threat to the national security and foreign policy of the United States","parent_excerpt":"Financial and diplomatic aspects of the relationship with Iran continue to present an unusual challenge to the national security and foreign policy of the United States.","explanation":"Parallel concluding determination that the country-specific situation continues to threaten or challenge national security and foreign policy."}]}