{"case_id":"SHC049","decision":"candidate","candidate_ranking":["C21","C17","C10"],"selected_candidate_label":"C21","confidence":0.99,"relationship_type":"both","rationale":"C21 is a near-direct predecessor for the same Sudan emergency. The child preserves C21's distinctive account of the 1997 declaration, the April 2006 expansion, and the October 2006 additional steps, followed by virtually identical unresolved-crisis, threat, and continuation language. The principal adaptations are the anniversary date, presidential signature, directive-reference style, and a minor change from “comprehensive sanctions” to “sanctions.” C17 and C10 share the same framework but omit parts of the distinctive three-directive history reproduced in the child.","shared_material":[{"child_excerpt":"The crisis constituted by the actions and policies of the Government of Sudan that led to the declaration of a national emergency in [DIRECTIVE_REFERENCE] of November 3, 1997, and the expansion of that emergency in [DIRECTIVE_REFERENCE] of April 26, 2006, and with respect to which additional steps were taken in [DIRECTIVE_REFERENCE] of October 13, 2006, has not been resolved.","parent_excerpt":"The crisis constituted by the actions and policies of the Government of Sudan that led to the declaration of a national emergency in [DIRECTIVE_REFERENCE] of November 3, 1997, and the expansion of that emergency in [DIRECTIVE_REFERENCE] of April 26, 2006, and with respect to which additional steps were taken in [DIRECTIVE_REFERENCE] of October 13, 2006, has not been resolved.","explanation":"This distinctive historical sequence is reproduced verbatim."},{"child_excerpt":"These actions and policies are hostile to U.S. interests and pose a continuing unusual and extraordinary threat to the national security and foreign policy of the United States.","parent_excerpt":"These actions and policies are hostile to U.S. interests and pose a continuing unusual and extraordinary threat to the national security and foreign policy of the United States.","explanation":"The substantive threat finding is identical."},{"child_excerpt":"Therefore, I have determined that it is necessary to continue the national emergency declared with respect to Sudan and maintain in force sanctions against Sudan to respond to this threat.","parent_excerpt":"Therefore, I have determined that it is necessary to continue the national emergency declared with respect to Sudan and maintain in force the comprehensive sanctions against Sudan to respond to this threat.","explanation":"The operative conclusion uses the same sequence and nearly identical wording, with only “comprehensive” omitted."}]}