{"case_id":"SHC021","decision":"candidate","candidate_ranking":["C21","C09","C01"],"selected_candidate_label":"C21","confidence":0.96,"relationship_type":"both","rationale":"C21 plausibly supplied a concrete drafting template for the child. Both are Obama letters to congressional leaders reporting an Executive Order that withdraws sanctions after positive political developments, recounting the original emergency and subsequent measures, finding that changed circumstances eliminate the need for those measures, announcing revocation, addressing a statutory sanctions waiver, and enclosing the order. The shared sequence and closely corresponding language are substantially more specific than routine reporting boilerplate. C09 is also a strong model for a letter revoking multiple sanctions orders while retaining or implementing other authorities, but its predicate and organization are less closely aligned. C01 shares the altered-circumstances/no-further-need/revocation structure but lacks the waiver and multiple-order machinery.","shared_material":[{"child_excerpt":"I hereby report that I have issued an Executive Order (the \"order\") that revokes sections 1 and 2 of [DIRECTIVE_REFERENCE] ... and revokes [DIRECTIVE_REFERENCE] ... in its entirety.","parent_excerpt":"I hereby report that I have issued an Executive Order (the \"order\") that terminates the national emergency ... and revokes that order, [and several additional orders].","explanation":"Both open by reporting an order that withdraws a package of sanctions authorities through revocation."},{"child_excerpt":"I have determined that the situation that gave rise to the actions taken in those orders ... has been altered by Sudan's positive actions","parent_excerpt":"I have determined that the situation that gave rise to the national emergency with respect to Burma has been significantly altered by Burma's substantial advances to promote democracy","explanation":"The central justification uses the same changed-circumstances determination tied to positive conduct by the sanctioned government."},{"child_excerpt":"With the positive steps taken by the Government of Sudan ... there will be no further need for sections 1 and 2 ... or for [the later order].","parent_excerpt":"With these advancements, U.S. national security and foreign policy interests no longer support the blocking of assets and other measures imposed by [the prior orders].","explanation":"Each moves from enumerated improvements to the conclusion that the existing asset-blocking and sanctions measures are no longer warranted."},{"child_excerpt":"For these reasons, I have determined that it is necessary to revoke sections 1 and 2 ... and to revoke [DIRECTIVE_REFERENCE]","parent_excerpt":"For these reasons I have determined that it is necessary to terminate the national emergency ... and to revoke that order, and [the related orders].","explanation":"This is a close verbal and functional match in the operative conclusion."},{"child_excerpt":"I have waived in the order the application of section 908(a)(1) ... and sections 6(a) and (b) of the Comprehensive Peace in Sudan Act","parent_excerpt":"I have determined and certify that it is in the national interest of the United States to waive, and have waived, the sanctions described in section 5(b) of the JADE Act.","explanation":"Both pair executive-order revocation with waiver of country-specific statutory sanctions."},{"child_excerpt":"I am enclosing a copy of the Executive Order I have issued.","parent_excerpt":"I am enclosing a copy of the Executive Order I have issued.","explanation":"Identical closing transmittal language reinforces the broader parallel structure, though this clause alone would be boilerplate."}]}