{"case_id":"SHC023","decision":"candidate","candidate_ranking":["C09","C24","C04"],"selected_candidate_label":"C09","confidence":0.99,"relationship_type":"both","rationale":"C09 plausibly supplied a concrete and material drafting template. The child expressly identifies the March 11, 2022 directive as an earlier step and closely reproduces C09's operative architecture: a subsection listing Russia-related prohibitions, including new investment, exports or supply, and facilitation of otherwise prohibited foreign transactions; the same exceptions clause; identical anti-evasion and conspiracy provisions; the same official-business exemption; substantially identical definitions; and nearly identical implementation and redelegation language. C24 is also a very strong related template, while C04 contains the same transactional machinery but is less immediately aligned with the child's Russia-wide sanctions and section sequence.","shared_material":[{"child_excerpt":"new investment in the Russian Federation by a United States person, wherever located","parent_excerpt":"new investment in any sector of the Russian Federation economy as may be determined ... by a United States person, wherever located","explanation":"The child adapts C09's Russia-focused new-investment prohibition by broadening it from designated sectors to the entire Russian Federation."},{"child_excerpt":"the exportation, reexportation, sale, or supply, directly or indirectly, from the United States, or by a United States person, wherever located","parent_excerpt":"the exportation, reexportation, sale, or supply, directly or indirectly, from the United States, or by a United States person, wherever located","explanation":"This distinctive operative formula is reproduced verbatim and adapted from specified goods and banknotes to Treasury-designated services."},{"child_excerpt":"any approval, financing, facilitation, or guarantee by a United States person ... where the transaction by that foreign person would be prohibited by this section if performed by a United States person or within the United States","parent_excerpt":"any approval, financing, facilitation, or guarantee by a United States person ... where the transaction by that foreign person would be prohibited by this section if performed by a United States person or within the United States","explanation":"The child reproduces C09's full foreign-transaction facilitation prohibition essentially verbatim."},{"child_excerpt":"Sec. 2. (a) Any transaction that evades or avoids ... (b) Any conspiracy formed to violate ... Sec. 3. Nothing in this order shall prohibit transactions for the conduct of the official business of the Federal Government or the United Nations","parent_excerpt":"Sec. 2. (a) Any transaction that evades or avoids ... (b) Any conspiracy formed to violate ... Sec. 3. Nothing in this order shall prohibit transactions for the conduct of the official business of the Federal Government or the United Nations","explanation":"The child preserves the same sequence and virtually identical wording for anti-circumvention rules and the governmental and UN business exemption."},{"child_excerpt":"The Secretary of the Treasury, in consultation with the Secretary of State, is hereby authorized to take such actions, including the promulgation of rules and regulations, and to employ all powers granted to the President by IEEPA ... may ... redelegate ... All executive departments and agencies ... shall take all appropriate measures","parent_excerpt":"The Secretary of the Treasury and the Secretary of Commerce, in consultation with the Secretary of State, are hereby authorized to take such actions, including the promulgation of rules and regulations, and to employ all powers granted to the President by IEEPA ... may ... redelegate ... All executive departments and agencies ... shall take all appropriate measures","explanation":"The child retains C09's implementation machinery while removing Commerce because the new prohibitions are administered principally by Treasury."}]}