{"case_id":"SHC050","decision":"candidate","candidate_ranking":["C20","C13","C06"],"selected_candidate_label":"C20","confidence":0.99,"relationship_type":"both","rationale":"C20 is a direct predecessor for the same Iraq emergency and supplies nearly the entire later letter's concrete drafting structure and much of its language. The child retains the same statutory explanation, notice-transmission sentence, unresolved-crisis paragraph, characterization of Iraqi conduct and threat, and determination to preserve economic-pressure authorities, with updates to the date, prior-notice reference, and a few phrases. C13 and C06 are weaker cross-target analogues sharing substantial language and structure, but C20 is decisively strongest.","shared_material":[{"child_excerpt":"The crisis between the United States and Iraq that led to the declaration of a national emergency on August 2, 1990, has not been resolved.","parent_excerpt":"The crisis between the United States and Iraq that led to the declaration on August 2, 1990, of a national emergency has not been resolved.","explanation":"Near-verbatim statement of the same emergency's origin and continued factual predicate."},{"child_excerpt":"The Government of Iraq continues to engage in activities inimical to stability in the Middle East and hostile to U.S. interests. Such Iraqi actions pose a continuing unusual and extraordinary threat to the national security and foreign policy of the United States.","parent_excerpt":"The Government of Iraq continues to engage in activities inimical to stability in the Middle East and hostile to United States interests in the region. Such Iraqi actions pose a continuing unusual and extraordinary threat to the national security and foreign policy of the United States.","explanation":"Distinctive, nearly identical description of Iraqi conduct and the resulting threat."},{"child_excerpt":"For these reasons, I have determined that it is necessary to continue the national emergency declared with respect to Iraq and to maintain in force the broad authorities necessary to apply economic pressure on the Government of Iraq.","parent_excerpt":"For these reasons, I have determined that it is necessary to maintain in force the broad authorities necessary to apply economic pressure on the Government of Iraq.","explanation":"The child preserves the parent's operative determination nearly verbatim while expressly adding continuation of the emergency."},{"child_excerpt":"In accordance with this provision, I have sent the enclosed notice, stating that the Iraq emergency is to continue in effect beyond August 2, 2002, to the Federal Register for publication.","parent_excerpt":"In accordance with this provision, I have sent the enclosed notice, stating that the Iraqi emergency is to continue in effect beyond August 2, 2000, to the Federal Register for publication.","explanation":"Same notice mechanism and sentence form, updated for the later anniversary."}]}