{"case_id":"SHC036","decision":"candidate","candidate_ranking":["C21","C10","C14"],"selected_candidate_label":"C21","confidence":0.99,"relationship_type":"both","rationale":"C21 is the directive expressly continued and expanded by the child. The child incorporates C21's emergency and definitions by reference and reuses its central drafting architecture: a direct-or-indirect rough-diamond import prohibition, licensing exceptions and prior-rights override, anti-evasion language, Treasury implementation under IEEPA and UNPA, agency direction, and a no-private-rights clause. It adapts that concrete machinery from Sierra Leone diamonds to diamonds passing through Liberia. C10 is a strong secondary analogue because it contains the earlier certificate-of-origin diamond-import mechanism, while C14 shares the anti-evasion-and-conspiracy formulation, but neither matches C21's direct lineage and overall structure.","shared_material":[{"child_excerpt":"the direct or indirect importation into the United States of all rough diamonds from Liberia, whether or not such diamonds originated in Liberia ... is prohibited","parent_excerpt":"the direct or indirect importation into the United States of all rough diamonds from Sierra Leone ... is prohibited","explanation":"The child's principal operative prohibition closely adapts C21's commodity-specific import clause to Liberia."},{"child_excerpt":"Any transaction by a United States person or within the United States that evades or avoids, or has the purpose of evading or avoiding, or attempts to violate","parent_excerpt":"Any transaction by a United States person or within the United States that evades or avoids, or has the purpose of evading or avoiding, or attempts to violate","explanation":"The anti-circumvention provision is reproduced nearly verbatim."},{"child_excerpt":"The definitions contained in section 4 of [DIRECTIVE_REFERENCE] apply to the terms used in this order.","parent_excerpt":"Sec. 4. For the purposes of this order: (a) the term \"person\" ... (d) the term \"rough diamond\" ...","explanation":"The child expressly incorporates C21's specialized definitions rather than redrafting them."},{"child_excerpt":"The Secretary of the Treasury, in consultation with the Secretary of State, is hereby authorized to take such actions, including the promulgation of rules and regulations, and to employ all powers granted to the President by IEEPA and UNPA","parent_excerpt":"The Secretary of the Treasury, in consultation with the Secretary of State, is hereby authorized to take such actions, including the promulgation of rules and regulations, and to employ all powers granted to the President by IEEPA and UNPA","explanation":"The implementation delegation and statutory machinery are copied verbatim in substance and sequence."}]}